{
    "symbol": "SPY",
    "decision_time": "2026-01-07T16:00:00-05:00",
    "ohlcv": [
        {
            "time": "2026-01-03T16:00:00-05:00",
            "open": 585.50,
            "high": 588.20,
            "low": 584.10,
            "close": 587.30,
            "volume": 45000000
        },
        {
            "time": "2026-01-06T16:00:00-05:00",
            "open": 587.30,
            "high": 590.10,
            "low": 586.00,
            "close": 589.50,
            "volume": 42000000
        },
        {
            "time": "2026-01-07T16:00:00-05:00",
            "open": 589.50,
            "high": 592.00,
            "low": 588.80,
            "close": 591.20,
            "volume": 38000000
        }
    ],
    "indicators": {
        "vol_5d": 0.12,
        "vol_30d": 0.15,
        "adx": 22.5,
        "atr": 4.25,
        "vix_proxy": 14.5,
        "adv_20d": 41000000
    },
    "market_context": {
        "spy_return_5d": 0.0085,
        "spy_vol_30d": 0.15
    },
    "meta": {
        "data_source_timestamps": {
            "ohlcv": "2026-01-07T16:00:00-05:00",
            "indicators": "2026-01-07T16:00:00-05:00"
        },
        "snapshot_hash": "a1b2c3d4e5f6789012345678901234567890abcd1234567890abcdef12345678"
    }
}